{
  "$schema": "http://json-schema.org/draft-07/schema#",
  "$id": "https://clawrocket.dev/contracts/editorial-room/v0/run_optimization.input.schema.json",
  "title": "RunOptimizationInput",
  "description": "MCP RPC: run_optimization input. Wraps an OptimizationConfig with target identity. See EDITORIAL_ROOM_CONTRACT.md §6.6.1.",
  "type": "object",
  "additionalProperties": false,
  "required": [
    "schema_version",
    "idempotency_key",
    "piece_id",
    "setup_version",
    "target_kind",
    "parent_object",
    "config"
  ],
  "properties": {
    "schema_version": { "const": "0" },
    "idempotency_key": {
      "type": "string",
      "minLength": 1,
      "description": "sha256(user_id|target_kind|parent_object_ref|setup_version|config_canonical_json) per §6.6.3."
    },
    "piece_id": {
      "anyOf": [{ "type": "null" }, { "type": "string", "minLength": 1 }],
      "description": "Null for Theme-search rounds."
    },
    "setup_version": {
      "anyOf": [{ "type": "null" }, { "type": "integer", "minimum": 1 }]
    },
    "target_kind": {
      "type": "string",
      "enum": [
        "theme",
        "topic",
        "point",
        "outline",
        "draft_polish",
        "draft_fullsearch"
      ]
    },
    "parent_object": {
      "anyOf": [
        { "type": "null" },
        {
          "type": "object",
          "additionalProperties": false,
          "required": ["kind", "ref"],
          "properties": {
            "kind": { "type": "string", "minLength": 1 },
            "ref": {
              "anyOf": [
                { "type": "null" },
                { "type": "string", "minLength": 1 }
              ]
            }
          }
        }
      ],
      "description": "e.g., { kind: 'theme', ref: 'theme/...' } for Topic optimization. Null for top-level Theme search."
    },
    "config": {
      "$ref": "https://clawrocket.dev/contracts/editorial-room/v0/optimization_config.schema.json"
    }
  }
}
