{
  "schema_version": "0",
  "idempotency_key": "sha256:idemkeyrunopttopic000000000000000000000000000000000000000000000",
  "piece_id": "piece_01HXYZ789ABC",
  "setup_version": 7,
  "target_kind": "topic",
  "parent_object": {
    "kind": "theme",
    "ref": "theme/ai-impact-on-game-dev"
  },
  "config": {
    "schema_version": "0",
    "persona_slugs": [
      "persona/ankit-indie-dev",
      "persona/ravi-studio-lead",
      "persona/mei-publisher"
    ],
    "n_candidates_per_iter": 8,
    "n_iterations": 3,
    "n_winners_carried": 5,
    "n_ssr_samples": 8,
    "top_k_returned": 5,
    "diversity_strategy": "default",
    "diversity_min_distance": 0.4,
    "cohort_targeted_subloops": false,
    "contrast_mutation_fraction": 0.4,
    "gates": {
      "rubric_min": { "specificity": 3, "disputability": 3 },
      "ssr_likelihood_min": 3.5,
      "diversity_min": 0.4,
      "slop_penalty_max": 5.0,
      "ssr_value_min": null
    },
    "objective_weights": {
      "ssr_likelihood_mean": 0.35,
      "ssr_value_mean": 0.2,
      "rubric_composite_mean": 0.3,
      "cohort_coverage": 0.05,
      "cohort_underservice_penalty": -0.05,
      "novelty_bonus": 0.15
    },
    "budget_usd": 5.0,
    "wallclock_cap_ms": null,
    "convergence_min_iters_for_signal": 2,
    "convergence_delta_threshold": 0.05,
    "context": null,
    "voice_slug": "voice/gamemakers-2026",
    "scoring_pipeline_slug": "scoring_pipeline/gamemakers_default"
  }
}
